{
 "schema_version": "1.0.0",
 "run_id": "20261018T093724Z-9fd45ddb-001",
 "test_id": "TST-M2-VMM-WP",
 "verdict": "PASS",
 "oracle": "firmware-independent: WP cleared -> supervisor write to the read-only header page goes through (restored); kernel's enable_wp -> write to .text raises #PF error code 3 (present, write, supervisor: SDM Fig. 7-11), CR2 = RIP = target; exit 173",
 "expected": "exit=173; markers=['OSX|9fd45ddba2cd|ktest|start|name=vmm_wp', '|exc|vector=14|name=#PF|error=0x3|', '|ktest|vmm_wp|wp_off_write_ok=1|wp_now=1|target=0x']; forbidden=['|ktest|fail|', '|kernel|panic|']; phases=1",
 "observed": "exit=173; serial_lines=30; missing=[]; forbidden_present=[]",
 "inputs_digest": "3f080324e33bea7978f30bca3d4b0b8701efb3fa3539e71b074def0b8c141d26",
 "inputs": {
  "Cargo.toml": "ee92e9abedf34d9b605b82e55f3febc07c82c24abe616e022b308403246fe80d",
  "kernel/Cargo.toml": "7efe7575312696786e1c2bcbbdc3b8c52cf49baa22affc7c3952fc6bb63d2a24",
  "kernel/build.rs": "a9afb0dbd17b6b4a4eaff6170d1a7255b417c900be26497afd55751cecbfc896",
  ".cargo/config.toml": "04f33880a4558b10c57b4dad27ba5e368a097c7c931fe694f1f8c9e130406a77",
  "rust-toolchain.toml": "4bf2c38ef0d4ef74d4c4177c31981fab2cf89514c4ade1f305da3f04520a0c50",
  "platform/pc-qemu/target.json": "9f9998cce2a0629b0b27a9be2298f9316c2789e192216ad3ec3857dccb198afa",
  "user/link.ld": "a434537416df96a8a06cb505ace16a938cd33d4dfe877407fd6201a38744af7d",
  "user/libnawah/Cargo.toml": "db677255d32cabfb6332b138f62535f2253ee5477a5e41c1a44c8b70e312bffb",
  "user/apps/hello/Cargo.toml": "02f10df2c1a1f9893ca3c1f0dd2ee0f1db16ae119e063a6b9d061e9307c7aabf",
  "user/apps/hello/build.rs": "e60c2a5dd3b305ea223b06c1355ba7a8a20711758a39a5d600c604a311ed622c",
  "tools/fat32.py": "ad57fdcbd46d444fea23ff76875d71bf955f2d16ce95d350da49533b4ed46f30",
  "user/apps/file_roundtrip/Cargo.toml": "ac2bbf3768fc23ccf7740b22999417834554d8056508ec0652ac6dac44d1a246",
  "user/apps/path_invalid/Cargo.toml": "9a6c9c283bce93ce666e9f46c20ccc5341795c3a424e4ad6bcb01e5987954d31",
  "user/apps/fd_leak/Cargo.toml": "271d999100486cf77337babc586cc55edac34670babf72ed725dedf3706371e3",
  "kernel/src/apps.rs": "17156e4cd91eb7f77b08448bb58556037eefc937b4cc31786deef9000b18d8ad",
  "kernel/src/arch/aarch64/mod.rs": "38420e695f0ae9520a1aefd4aa74dde4ad69fdaf9bbff6002ed0cbffd49660bc",
  "kernel/src/arch/aarch64/qemu.rs": "fd537cd321ed2e7cf49bd8782bdc2341800e8b431fd16b71aff16bc91fa0498d",
  "kernel/src/arch/aarch64/serial.rs": "861b9efee3c6b13b0276ce4315540a0d5a25fbed829b0dc7bf879cc3d97c6ffa",
  "kernel/src/arch/mod.rs": "1bd2287ccf6400cf613e73022336f9bf0c4c3a7ab4914069ec4d82101381b90a",
  "kernel/src/arch/x86_64/acpi.rs": "9d84b03ca009b7b5d8a1b8ba255d896dfc41ec078610b2eec62d49205e2b8867",
  "kernel/src/arch/x86_64/apic.rs": "dcb8a4e76815aa3207c445f4f57d7e8c528df17210a5a4e30b0ad028cd7f2fa1",
  "kernel/src/arch/x86_64/context.rs": "0142a797cf707613ebf1e0d4cdbc93efe5caf50f377e1211e77beb178432ea7f",
  "kernel/src/arch/x86_64/fwcfg.rs": "e021c6aeac77a5fe333e2d757f6b8bcf76a7e62fb86af8bb59a33e726e782d3e",
  "kernel/src/arch/x86_64/gdt.rs": "63f2b5b6ebca5297401d1cb874791a7ba7e496d868f75f756dd6b1c90d4db482",
  "kernel/src/arch/x86_64/idt.rs": "3f2d4c7025328d44462bae18e8acf623b826698a4b2054b6e052d30799998192",
  "kernel/src/arch/x86_64/ioapic.rs": "3f90e8a4fb369d2e232247adbcc0b71e99db29c2b6dae184e4b88d1c423a3cec",
  "kernel/src/arch/x86_64/irq.rs": "3810e94970eb30e01e4d965bb46c735d7194445e4b0a6b3066c23f5435de908c",
  "kernel/src/arch/x86_64/ktest.rs": "f0aa4c5912262834cc9162a3b6b0113cac093d3f09eeb129eb1c821039eee207",
  "kernel/src/arch/x86_64/mmio.rs": "5484ac7afb63e810fc2fd88859d804df474ac2f3390e4b22ab41cf3d08c63b94",
  "kernel/src/arch/x86_64/mod.rs": "9635738eef5a5a2f6d730d63b55b5bd8ce2a5dc88ce987207d1def65b4b3e6e9",
  "kernel/src/arch/x86_64/paging.rs": "864b9754739361c2a85b5d79328099e68601d6dc5b6669f4773ccf785192edec",
  "kernel/src/arch/x86_64/pci.rs": "3938f7010b42bd991b5629de84ab972d73f25025d7e402348b0acd3c3d6877da",
  "kernel/src/arch/x86_64/pic.rs": "0563f6cc635ec439b5300986cafddc4156a67a3a3d26044ee0b11a30f3af94b2",
  "kernel/src/arch/x86_64/pit.rs": "c6129002caf1ba3f53a1f705de7b55c6c166a227eb6e8a1612dceedc784b8b82",
  "kernel/src/arch/x86_64/port.rs": "996135a95894a3444b207b6f100563d8031e5100586daffa9bd5c2915bf4a7e9",
  "kernel/src/arch/x86_64/qemu.rs": "c60573710d45a99deecac152b8bfb15828552dbfcac9a51b7e38803f1b4d697d",
  "kernel/src/arch/x86_64/serial.rs": "06c8594a1724b757bc66b89b7f1a5339c9d2b3ebc76a0fb9966aed13683f55a1",
  "kernel/src/arch/x86_64/smp.rs": "695d1800902a9de4ffa404d345f71df3cf84e849a179f6dcdddc8c5a051cfe1c",
  "kernel/src/arch/x86_64/syscall.rs": "b25faa136323deca33e8e8cf77e6b64dfea6e0a44212669dedc85c9cec26cd2c",
  "kernel/src/arch/x86_64/tlb.rs": "fbab3b93a0d20e43afa532d672220fd693c43c3cb7a1f0418ea8bcd038be0466",
  "kernel/src/arch/x86_64/trap.rs": "ec78e2e3c53964171e4a91a52bbfbce8023339f5dcbdb7d55be3530c2c14d55d",
  "kernel/src/arch/x86_64/user_programs.rs": "ca153e20ba2039e08473676c58b64f74ca8627213171cdf61be96d6df85bb0bb",
  "kernel/src/block/mod.rs": "45e25137065277c1a490564ef30343ddc398fe6819016a34a1b386a363680935",
  "kernel/src/boot/efi.rs": "ffb66748014393ea9aad02937ae69ad6fb2b0ade790348dfb191a39f01582167",
  "kernel/src/boot/mod.rs": "ecb0e4d50454565d720d5774843d32b3f279a58ae4569270ffc2e96908402b21",
  "kernel/src/boot/stub.rs": "01968a9c4ceb77965d9b2e61bbc2b2499b3f663b6c0d98444c060a6f7f7f3539",
  "kernel/src/bootinfo.rs": "1754e069cba821b11498a386127adea49d1eb0f5d125ef5fbc01c8bc4110b3a6",
  "kernel/src/cell.rs": "cee0e78c795d30aa2d94301091a7f117b45f98b37ff8131d0d5ec10f7dcf144e",
  "kernel/src/console.rs": "1c6bf4d636172bbd26dea9fd104cfae12873661f88e880d8e44ae99565771a19",
  "kernel/src/drivers/mod.rs": "1b21270bbc747aff43404fcb42a2475db5a3ae987b5f266e581816e259f5d086",
  "kernel/src/drivers/virtio_blk.rs": "16df73696e259cf773d7fd506cb5c8417100c91aae9645ac1e5f5cccf16f6a87",
  "kernel/src/fs/fat32.rs": "b13cee23aff46d043eb7789af559c72c8a4b616b0784bd7639086179ebe0d0cd",
  "kernel/src/fs/mod.rs": "c9022502ce6aadfd8312ef62e1d1cd4ed7aee4d137ec7367fe924136801163ad",
  "kernel/src/fs/vfs.rs": "c973463d1263b0482d280eab08beff3f77acf51c1ec95903859b6be5ac314f0a",
  "kernel/src/kmain.rs": "325bf3ea6ed65ff50fec43876b9579e253887ad66e8657c3540001ccbdd0b963",
  "kernel/src/ktest.rs": "cac3042d044108dfd1a8db7664de0d02b1f8865c0d21c26d27d8b19efe2e54c0",
  "kernel/src/loader/elf.rs": "20675658cd900273c81e253b6f888ed029a9dfa74e14d818ad9c039d6f13564f",
  "kernel/src/loader/mod.rs": "8b48caf5bfda222aab650f10b683898e3cacb8f10892515b8e7321638cb5d879",
  "kernel/src/main.rs": "e49fb582a55f35845d16e00439fe08ed1abe85c1b8877d2170de1580293f101a",
  "kernel/src/mm/addrspace.rs": "49335f24ac0a1727d09c4b2b8793c63720a5324032bea4b67b5fc0bfe3849fcf",
  "kernel/src/mm/dma.rs": "c2b0fb6856528e12c290ed0ab48c4d578eda9257ef19b00954f066745b6d5785",
  "kernel/src/mm/heap.rs": "39c5ab7e769f8ec2e5878496916981c32fe514296f40fe49fec1a18a9ee60016",
  "kernel/src/mm/mod.rs": "8d3d2818e4f995cbb816a0c11aceb984d7ab3c338cd7f53861786f2a5bdbd68d",
  "kernel/src/mm/pmm.rs": "519a105f8ab348a31a35ac08e60cd53556d6682cad79a233c9f82617a674178e",
  "kernel/src/mm/vmm.rs": "46b37efeb15341f1de1dc7e103da990364b70d81ac2e7bfe019e831f6688596c",
  "kernel/src/object/channel.rs": "7964342d9cf9a21b8e3276996f48f15a3243100a56fe57df6e71e45ab243ad94",
  "kernel/src/object/handle.rs": "59f0f6cc5e7539cae44e56294b44a5c943db4c10a65d1af255e9fb168c8ac888",
  "kernel/src/object/mod.rs": "e5dd00c4db446af537ddfa1829e37f07778dabc0c2fb1cf3129bd1b7ec39122d",
  "kernel/src/panic.rs": "adc0270761320b72644f4cd1fb23ab38676782cc8effadb3db151bf5522a0dcb",
  "kernel/src/sched/mod.rs": "017bb79978b9347e2150c07ce57e460140f7d5bf30a9f1cd9f15291f5dc3175f",
  "kernel/src/sync.rs": "8a86cc6740aa4789771692fdc365975234c46f56289c0ad3f1b1efcec108b203",
  "kernel/src/syscall/mod.rs": "c5d7fe634678310e2ed84677c1de4cbeefad85e3fdb7b5db4b20446fe945c739",
  "kernel/src/user.rs": "021886981f103f7603ed0771b0876d4cf24120be0a13a5242a2a5af7d479404a",
  "user/apps/fd_leak/build.rs": "e60c2a5dd3b305ea223b06c1355ba7a8a20711758a39a5d600c604a311ed622c",
  "user/apps/fd_leak/src/main.rs": "91a2dd28dff960ea62d57cbb1ee6cff09bd6d8fb7f050d88d6bcdc1ccd190de4",
  "user/apps/file_roundtrip/build.rs": "e60c2a5dd3b305ea223b06c1355ba7a8a20711758a39a5d600c604a311ed622c",
  "user/apps/file_roundtrip/src/main.rs": "7f617109bea4e67ac4da262b9935ea3dd2915b28d125d4ec0ace51ddda1932cd",
  "user/apps/hello/src/main.rs": "362ae5c1b117958ba89efb101749c54b6c831ae17d073f44513e2f1909aeb6b1",
  "user/apps/path_invalid/build.rs": "e60c2a5dd3b305ea223b06c1355ba7a8a20711758a39a5d600c604a311ed622c",
  "user/apps/path_invalid/src/main.rs": "349b0ab9e81ae11ae4419bd4b351911c10d0a18bb62d9e88c890447a5b619044",
  "user/libnawah/src/lib.rs": "b345f3610a68b8c737621a497ee78b015cd6087f662f40a24fc737f96c898910",
  "evidence/20261018T093724Z-9fd45ddb-001/artifact/NAWAH-KTEST.EFI": "d3dc81edfca5564775aa3d22f06f18e05f5af7c22c208d8d58c5ec2b5bbd6a85"
 },
 "claim_tag": "source_backed_fact",
 "reason": "exit code and serial markers match oracle"
}
