{
 "schema_version": "1.0.0",
 "run_id": "20261018T060755Z-6587f51f-001",
 "test_id": "TST-M2-SPURIOUS",
 "verdict": "PASS",
 "oracle": "software int 0xFF (spurious: counted, no EOI), int 0x20 (masked PIC vector) and int 0xF0 (unassigned) are counted as unexpected and return; with the timer stopped and interrupts enabled for 20 ms nothing arrives; SVR = 0x1FF; exit 33",
 "expected": "exit=33; markers=['OSX|6587f51f2ac1|ktest|start|name=spurious', '|ktest|spurious|spurious=1|unexpected=2|last_unexpected=0xf0|total_after_window=0|svr=0x1ff', '|ktest|pass|spurious and masked vectors are counted, never fault']; forbidden=['|ktest|fail|', '|kernel|panic|', '|exc|vector']",
 "observed": "exit=33; serial_lines=18; missing=[]; forbidden_present=[]",
 "inputs_digest": "6c6f1cc1878da2e890d4d4a1eb8747bc4ef7084b8fbf7779e59cb96b8d3eb54c",
 "inputs": {
  "Cargo.toml": "54810cc7a1974e939ae532f9f0fcec0b12314ff655f65e76736fd5f8f3893a5a",
  "kernel/Cargo.toml": "7efe7575312696786e1c2bcbbdc3b8c52cf49baa22affc7c3952fc6bb63d2a24",
  "kernel/build.rs": "922cec73e6fe957dfcca1ab67d1ea9578cc2a78c139c0f689bb55d4f18df2771",
  ".cargo/config.toml": "8c8fbae734dce19ac6af91ead651ff7b5bc69c335afdb0b1d1b44c9591656034",
  "rust-toolchain.toml": "4bf2c38ef0d4ef74d4c4177c31981fab2cf89514c4ade1f305da3f04520a0c50",
  "platform/pc-qemu/target.json": "a6ea680b105bc2ceec8fd5b921c8e8c9afb663a6c8e5254a8ca40584b1dabbc8",
  "kernel/src/arch/aarch64/mod.rs": "a41c04248f2d433664b64bb14af066999842ab8051b3feb0e4c03dc7ca8dd682",
  "kernel/src/arch/aarch64/qemu.rs": "fd537cd321ed2e7cf49bd8782bdc2341800e8b431fd16b71aff16bc91fa0498d",
  "kernel/src/arch/aarch64/serial.rs": "861b9efee3c6b13b0276ce4315540a0d5a25fbed829b0dc7bf879cc3d97c6ffa",
  "kernel/src/arch/mod.rs": "2afc0e94efbd7cf9119005da0ba61cc77b1445b40b127e5b384f76c32d5bbb79",
  "kernel/src/arch/x86_64/acpi.rs": "e30e8943340279a81901d0263c6e9d249185104a50df6ae48db9aceebb0159bf",
  "kernel/src/arch/x86_64/apic.rs": "5f3cdc1badd277f4c0fa266644bfd9c532a0d1a37e02e982282be8a664a6949d",
  "kernel/src/arch/x86_64/fwcfg.rs": "e021c6aeac77a5fe333e2d757f6b8bcf76a7e62fb86af8bb59a33e726e782d3e",
  "kernel/src/arch/x86_64/gdt.rs": "2d781c5000d4c94d36b5d8c21b5fe02c6d03a8a0dee80e830e2273dd021cd221",
  "kernel/src/arch/x86_64/idt.rs": "e06da635ca087c86320f07986efcc7a6811f272d6a893c4f1c02b43b2b24ce67",
  "kernel/src/arch/x86_64/ioapic.rs": "3f90e8a4fb369d2e232247adbcc0b71e99db29c2b6dae184e4b88d1c423a3cec",
  "kernel/src/arch/x86_64/irq.rs": "5db9ab4587f3f4a3f7a3cac5eaec0ce26a19a54ac88080bc478c4c3cfd0bcaf5",
  "kernel/src/arch/x86_64/ktest.rs": "f0aa4c5912262834cc9162a3b6b0113cac093d3f09eeb129eb1c821039eee207",
  "kernel/src/arch/x86_64/mod.rs": "676801e27b8801a60908eb85542c740f2c68d905a65c934c8b30de9d25b23daa",
  "kernel/src/arch/x86_64/paging.rs": "806d88037e20ae2a3ee458f0dac4c79673959464e6f8184ee48aba7d8162b957",
  "kernel/src/arch/x86_64/pic.rs": "0563f6cc635ec439b5300986cafddc4156a67a3a3d26044ee0b11a30f3af94b2",
  "kernel/src/arch/x86_64/pit.rs": "c55d4335a3454f6ba35b8604c1d0a2c243102b8cd8c5275d7342a0aca7e7b14e",
  "kernel/src/arch/x86_64/port.rs": "996135a95894a3444b207b6f100563d8031e5100586daffa9bd5c2915bf4a7e9",
  "kernel/src/arch/x86_64/qemu.rs": "c60573710d45a99deecac152b8bfb15828552dbfcac9a51b7e38803f1b4d697d",
  "kernel/src/arch/x86_64/serial.rs": "06c8594a1724b757bc66b89b7f1a5339c9d2b3ebc76a0fb9966aed13683f55a1",
  "kernel/src/arch/x86_64/syscall.rs": "b16ddaaaae2be99c65d62c94ffc6024d0518889b73827af5585ad798ecbf5f7b",
  "kernel/src/arch/x86_64/trap.rs": "b4b506b6aec4631ac81dd7c345f1437ca992253bd4dad58cc8858d9124b8382c",
  "kernel/src/arch/x86_64/user_programs.rs": "666c5f1dcdad03cf1bcd860452146cac0e4d58882a9e20fe3732a001ba128e64",
  "kernel/src/boot/efi.rs": "ffb66748014393ea9aad02937ae69ad6fb2b0ade790348dfb191a39f01582167",
  "kernel/src/boot/mod.rs": "ecb0e4d50454565d720d5774843d32b3f279a58ae4569270ffc2e96908402b21",
  "kernel/src/boot/stub.rs": "01968a9c4ceb77965d9b2e61bbc2b2499b3f663b6c0d98444c060a6f7f7f3539",
  "kernel/src/bootinfo.rs": "1754e069cba821b11498a386127adea49d1eb0f5d125ef5fbc01c8bc4110b3a6",
  "kernel/src/cell.rs": "cee0e78c795d30aa2d94301091a7f117b45f98b37ff8131d0d5ec10f7dcf144e",
  "kernel/src/console.rs": "1c6bf4d636172bbd26dea9fd104cfae12873661f88e880d8e44ae99565771a19",
  "kernel/src/kmain.rs": "f522f82d01071b2b6556e53bc7a8b47247a58ff83acdb5af42a604c5423e83a6",
  "kernel/src/ktest.rs": "e1b5bb380fe95968512e88bc37d677ff0587cf8f791c606f5ba9ee538e1abc14",
  "kernel/src/main.rs": "8ab85b61a5c14e62cce5e6976753bd9b027a4b4a67986421b1784989d35a40b2",
  "kernel/src/mm/addrspace.rs": "c3398a12c164e81db90500d5875fc6bc09e3fc9552d950ad71f1539695e6e201",
  "kernel/src/mm/heap.rs": "39c5ab7e769f8ec2e5878496916981c32fe514296f40fe49fec1a18a9ee60016",
  "kernel/src/mm/mod.rs": "c1a1b0044668f1b1342b53953fd6a955a35fe18b8f05e1ad51c28b1305b2067a",
  "kernel/src/mm/pmm.rs": "519a105f8ab348a31a35ac08e60cd53556d6682cad79a233c9f82617a674178e",
  "kernel/src/mm/vmm.rs": "ba53d45774dbeb4f8aa84ba25042729ff9c2aa341252a3a923d0e76e9a1b2fad",
  "kernel/src/panic.rs": "adc0270761320b72644f4cd1fb23ab38676782cc8effadb3db151bf5522a0dcb",
  "kernel/src/sync.rs": "8fcf41c183370513c0bc765d386fb9a3bb331483183e0556d0547922683f1c87",
  "kernel/src/syscall/mod.rs": "12a3bc3de440cc308254cd67b4438696a3d9460daea1f6991006a124c19fc79d",
  "kernel/src/user.rs": "6d54fd1980297533f9972f8806bd93675bea32cbf85863d1c3089c7a5651cf57",
  "evidence/20261018T060755Z-6587f51f-001/artifact/NAWAH-KTEST.EFI": "a6b4e298a4512cd2a08691b2e6ccaebd094f0f30dd11873e966a2ca2cc04dc46"
 },
 "claim_tag": "source_backed_fact",
 "reason": "exit code and serial markers match oracle"
}
