{
 "schema_version": "1.0.0",
 "run_id": "20261018T073718Z-03754f06-001",
 "test_id": "TST-M2-IDT-LAYOUT",
 "verdict": "PASS",
 "oracle": "sidt-based walk: 0..=31 present interrupt gates to stubs pushing the vector (dummy 0 where the CPU pushes no error code); 32..=255 present interrupt gates to the uniform interrupt entries (push 0, push imm32 vector); exit 33",
 "expected": "exit=33; markers=['OSX|03754f064460|ktest|start|name=idt_layout', '|ktest|pass|idt layout']; forbidden=['|ktest|fail|', '|kernel|panic|', '|idt_layout|vector=']",
 "observed": "exit=33; serial_lines=21; missing=[]; forbidden_present=[]",
 "inputs_digest": "8b07387341d49fadedec7d2ddd369d624cdd776e9f05fe162079df97e13da97d",
 "inputs": {
  "Cargo.toml": "06f761ecba763088ee87bda410a8981c490eacd5befa3236cc4fd7de519c8d23",
  "kernel/Cargo.toml": "7efe7575312696786e1c2bcbbdc3b8c52cf49baa22affc7c3952fc6bb63d2a24",
  "kernel/build.rs": "6b36e7639ae29b74361a5b013bbdfd864cb5b260819a78d88f3a05e972e1ac23",
  ".cargo/config.toml": "04f33880a4558b10c57b4dad27ba5e368a097c7c931fe694f1f8c9e130406a77",
  "rust-toolchain.toml": "4bf2c38ef0d4ef74d4c4177c31981fab2cf89514c4ade1f305da3f04520a0c50",
  "platform/pc-qemu/target.json": "1c68e75e977a65240d0ab01adc4a7ec313223041bc9ab406b756f39175ab009c",
  "user/link.ld": "a434537416df96a8a06cb505ace16a938cd33d4dfe877407fd6201a38744af7d",
  "user/libnawah/Cargo.toml": "db677255d32cabfb6332b138f62535f2253ee5477a5e41c1a44c8b70e312bffb",
  "user/apps/hello/Cargo.toml": "02f10df2c1a1f9893ca3c1f0dd2ee0f1db16ae119e063a6b9d061e9307c7aabf",
  "user/apps/hello/build.rs": "e60c2a5dd3b305ea223b06c1355ba7a8a20711758a39a5d600c604a311ed622c",
  "kernel/src/apps.rs": "17156e4cd91eb7f77b08448bb58556037eefc937b4cc31786deef9000b18d8ad",
  "kernel/src/arch/aarch64/mod.rs": "a41c04248f2d433664b64bb14af066999842ab8051b3feb0e4c03dc7ca8dd682",
  "kernel/src/arch/aarch64/qemu.rs": "fd537cd321ed2e7cf49bd8782bdc2341800e8b431fd16b71aff16bc91fa0498d",
  "kernel/src/arch/aarch64/serial.rs": "861b9efee3c6b13b0276ce4315540a0d5a25fbed829b0dc7bf879cc3d97c6ffa",
  "kernel/src/arch/mod.rs": "d1cf53ec19a7ecbcb99a879f6dd047301e7d066f67c9d41889f737ad325e014c",
  "kernel/src/arch/x86_64/acpi.rs": "e30e8943340279a81901d0263c6e9d249185104a50df6ae48db9aceebb0159bf",
  "kernel/src/arch/x86_64/apic.rs": "5f3cdc1badd277f4c0fa266644bfd9c532a0d1a37e02e982282be8a664a6949d",
  "kernel/src/arch/x86_64/context.rs": "0142a797cf707613ebf1e0d4cdbc93efe5caf50f377e1211e77beb178432ea7f",
  "kernel/src/arch/x86_64/fwcfg.rs": "e021c6aeac77a5fe333e2d757f6b8bcf76a7e62fb86af8bb59a33e726e782d3e",
  "kernel/src/arch/x86_64/gdt.rs": "2d781c5000d4c94d36b5d8c21b5fe02c6d03a8a0dee80e830e2273dd021cd221",
  "kernel/src/arch/x86_64/idt.rs": "e06da635ca087c86320f07986efcc7a6811f272d6a893c4f1c02b43b2b24ce67",
  "kernel/src/arch/x86_64/ioapic.rs": "3f90e8a4fb369d2e232247adbcc0b71e99db29c2b6dae184e4b88d1c423a3cec",
  "kernel/src/arch/x86_64/irq.rs": "68b5a7cefca5b8a10f85e7aa1d89590868c96c6f201d37e6d6da7a0efb9e5c8e",
  "kernel/src/arch/x86_64/ktest.rs": "f0aa4c5912262834cc9162a3b6b0113cac093d3f09eeb129eb1c821039eee207",
  "kernel/src/arch/x86_64/mod.rs": "dad9b7009932c03fb1efc6afa49a32ec20141805320b49cb8b92ccc485fc655e",
  "kernel/src/arch/x86_64/paging.rs": "864b9754739361c2a85b5d79328099e68601d6dc5b6669f4773ccf785192edec",
  "kernel/src/arch/x86_64/pic.rs": "0563f6cc635ec439b5300986cafddc4156a67a3a3d26044ee0b11a30f3af94b2",
  "kernel/src/arch/x86_64/pit.rs": "c55d4335a3454f6ba35b8604c1d0a2c243102b8cd8c5275d7342a0aca7e7b14e",
  "kernel/src/arch/x86_64/port.rs": "996135a95894a3444b207b6f100563d8031e5100586daffa9bd5c2915bf4a7e9",
  "kernel/src/arch/x86_64/qemu.rs": "c60573710d45a99deecac152b8bfb15828552dbfcac9a51b7e38803f1b4d697d",
  "kernel/src/arch/x86_64/serial.rs": "06c8594a1724b757bc66b89b7f1a5339c9d2b3ebc76a0fb9966aed13683f55a1",
  "kernel/src/arch/x86_64/syscall.rs": "64ddaf89484102146ee56dd2777dcdd3bb3e316d08a845337cd0002882ee5499",
  "kernel/src/arch/x86_64/trap.rs": "42a5b084a78f72e315cde7a543f1bcb9136d64b1b84bfa38260c3a2cadfd3b92",
  "kernel/src/arch/x86_64/user_programs.rs": "1e695b2f8de69d8586ef499293f0a0f0a72eefe4601fe6d4ba5d0929b5562889",
  "kernel/src/boot/efi.rs": "ffb66748014393ea9aad02937ae69ad6fb2b0ade790348dfb191a39f01582167",
  "kernel/src/boot/mod.rs": "ecb0e4d50454565d720d5774843d32b3f279a58ae4569270ffc2e96908402b21",
  "kernel/src/boot/stub.rs": "01968a9c4ceb77965d9b2e61bbc2b2499b3f663b6c0d98444c060a6f7f7f3539",
  "kernel/src/bootinfo.rs": "1754e069cba821b11498a386127adea49d1eb0f5d125ef5fbc01c8bc4110b3a6",
  "kernel/src/cell.rs": "cee0e78c795d30aa2d94301091a7f117b45f98b37ff8131d0d5ec10f7dcf144e",
  "kernel/src/console.rs": "1c6bf4d636172bbd26dea9fd104cfae12873661f88e880d8e44ae99565771a19",
  "kernel/src/kmain.rs": "7dbe6d36c1660a08f740bdb54287df0e27fce0fb17a98765ea419e32ed71f614",
  "kernel/src/ktest.rs": "070c80b8e3ca769ceace0dad2c41372e867a43f5b0d40ed8b9a9738b817d26bd",
  "kernel/src/loader/elf.rs": "20675658cd900273c81e253b6f888ed029a9dfa74e14d818ad9c039d6f13564f",
  "kernel/src/loader/mod.rs": "8b48caf5bfda222aab650f10b683898e3cacb8f10892515b8e7321638cb5d879",
  "kernel/src/main.rs": "2f1468de2db84330b9f8068e3a5c21933605e14e0df8a7975d74dd2bf97bfaac",
  "kernel/src/mm/addrspace.rs": "49335f24ac0a1727d09c4b2b8793c63720a5324032bea4b67b5fc0bfe3849fcf",
  "kernel/src/mm/heap.rs": "39c5ab7e769f8ec2e5878496916981c32fe514296f40fe49fec1a18a9ee60016",
  "kernel/src/mm/mod.rs": "c1a1b0044668f1b1342b53953fd6a955a35fe18b8f05e1ad51c28b1305b2067a",
  "kernel/src/mm/pmm.rs": "519a105f8ab348a31a35ac08e60cd53556d6682cad79a233c9f82617a674178e",
  "kernel/src/mm/vmm.rs": "26330794a5e0ec62fe9ceaabe8b9452ca8aeaba3f537a33e8a361fb8200cf0bc",
  "kernel/src/object/channel.rs": "7964342d9cf9a21b8e3276996f48f15a3243100a56fe57df6e71e45ab243ad94",
  "kernel/src/object/handle.rs": "59f0f6cc5e7539cae44e56294b44a5c943db4c10a65d1af255e9fb168c8ac888",
  "kernel/src/object/mod.rs": "ca17006de4af9d7d21209dbeea364525200206da163bae3848fe32bb3cec90db",
  "kernel/src/panic.rs": "adc0270761320b72644f4cd1fb23ab38676782cc8effadb3db151bf5522a0dcb",
  "kernel/src/sched/mod.rs": "207c6cb7d9e7cf220d5eeb34eaa6920098364aaaf49d6700ff816c5acecd7e98",
  "kernel/src/sync.rs": "8fcf41c183370513c0bc765d386fb9a3bb331483183e0556d0547922683f1c87",
  "kernel/src/syscall/mod.rs": "7e17416b72e255a55ad73423a69948d870d5a125d460a1ec8987d5035b1652ba",
  "kernel/src/user.rs": "021886981f103f7603ed0771b0876d4cf24120be0a13a5242a2a5af7d479404a",
  "user/apps/hello/src/main.rs": "362ae5c1b117958ba89efb101749c54b6c831ae17d073f44513e2f1909aeb6b1",
  "user/libnawah/src/lib.rs": "b53a692caee61b8ac4ca96efca283454f7ed7eb4f81df7969ff60c3f72e1e6ef",
  "evidence/20261018T073718Z-03754f06-001/artifact/NAWAH-KTEST.EFI": "8f0aa66954e621c920aa3f467e2c9fb4b2bd20535a5031365e946dafb29f4966"
 },
 "claim_tag": "source_backed_fact",
 "reason": "exit code and serial markers match oracle"
}
