{
 "schema_version": "1.0.0",
 "run_id": "20261018T070919Z-0e8a0e93-001",
 "test_id": "TST-M2-LOCK-REENTRY",
 "verdict": "PASS",
 "oracle": "re-acquiring a held IrqSpinLock on the same CPU panics with K_E_LOCK_REENTRY|lock=ktest_lock instead of hanging; exit 35",
 "expected": "exit=35; markers=['OSX|0e8a0e939ca3|ktest|start|name=lock_reentry', 'OSX|0e8a0e939ca3|kernel|panic|loc=', '|ktest|lock_reentry|held=1|reacquiring=1', 'src/sync.rs:', '|msg=K_E_LOCK_REENTRY|lock=ktest_lock|cpu=0']; forbidden=['|ktest|fail|', '|exc|vector', '|panic|nested|']",
 "observed": "exit=35; serial_lines=20; missing=[]; forbidden_present=[]",
 "inputs_digest": "6a134630d44ca4c157222403992436d6086d5a073cd7cab2922cec9bb6e06e23",
 "inputs": {
  "Cargo.toml": "54810cc7a1974e939ae532f9f0fcec0b12314ff655f65e76736fd5f8f3893a5a",
  "kernel/Cargo.toml": "7efe7575312696786e1c2bcbbdc3b8c52cf49baa22affc7c3952fc6bb63d2a24",
  "kernel/build.rs": "922cec73e6fe957dfcca1ab67d1ea9578cc2a78c139c0f689bb55d4f18df2771",
  ".cargo/config.toml": "8c8fbae734dce19ac6af91ead651ff7b5bc69c335afdb0b1d1b44c9591656034",
  "rust-toolchain.toml": "4bf2c38ef0d4ef74d4c4177c31981fab2cf89514c4ade1f305da3f04520a0c50",
  "platform/pc-qemu/target.json": "6cad71ef62a068418e8f0fd367bb80320e3075ff14364341865bdc56060dadf8",
  "kernel/src/arch/aarch64/mod.rs": "a41c04248f2d433664b64bb14af066999842ab8051b3feb0e4c03dc7ca8dd682",
  "kernel/src/arch/aarch64/qemu.rs": "fd537cd321ed2e7cf49bd8782bdc2341800e8b431fd16b71aff16bc91fa0498d",
  "kernel/src/arch/aarch64/serial.rs": "861b9efee3c6b13b0276ce4315540a0d5a25fbed829b0dc7bf879cc3d97c6ffa",
  "kernel/src/arch/mod.rs": "d1cf53ec19a7ecbcb99a879f6dd047301e7d066f67c9d41889f737ad325e014c",
  "kernel/src/arch/x86_64/acpi.rs": "e30e8943340279a81901d0263c6e9d249185104a50df6ae48db9aceebb0159bf",
  "kernel/src/arch/x86_64/apic.rs": "5f3cdc1badd277f4c0fa266644bfd9c532a0d1a37e02e982282be8a664a6949d",
  "kernel/src/arch/x86_64/context.rs": "0142a797cf707613ebf1e0d4cdbc93efe5caf50f377e1211e77beb178432ea7f",
  "kernel/src/arch/x86_64/fwcfg.rs": "e021c6aeac77a5fe333e2d757f6b8bcf76a7e62fb86af8bb59a33e726e782d3e",
  "kernel/src/arch/x86_64/gdt.rs": "2d781c5000d4c94d36b5d8c21b5fe02c6d03a8a0dee80e830e2273dd021cd221",
  "kernel/src/arch/x86_64/idt.rs": "e06da635ca087c86320f07986efcc7a6811f272d6a893c4f1c02b43b2b24ce67",
  "kernel/src/arch/x86_64/ioapic.rs": "3f90e8a4fb369d2e232247adbcc0b71e99db29c2b6dae184e4b88d1c423a3cec",
  "kernel/src/arch/x86_64/irq.rs": "68b5a7cefca5b8a10f85e7aa1d89590868c96c6f201d37e6d6da7a0efb9e5c8e",
  "kernel/src/arch/x86_64/ktest.rs": "f0aa4c5912262834cc9162a3b6b0113cac093d3f09eeb129eb1c821039eee207",
  "kernel/src/arch/x86_64/mod.rs": "dad9b7009932c03fb1efc6afa49a32ec20141805320b49cb8b92ccc485fc655e",
  "kernel/src/arch/x86_64/paging.rs": "864b9754739361c2a85b5d79328099e68601d6dc5b6669f4773ccf785192edec",
  "kernel/src/arch/x86_64/pic.rs": "0563f6cc635ec439b5300986cafddc4156a67a3a3d26044ee0b11a30f3af94b2",
  "kernel/src/arch/x86_64/pit.rs": "c55d4335a3454f6ba35b8604c1d0a2c243102b8cd8c5275d7342a0aca7e7b14e",
  "kernel/src/arch/x86_64/port.rs": "996135a95894a3444b207b6f100563d8031e5100586daffa9bd5c2915bf4a7e9",
  "kernel/src/arch/x86_64/qemu.rs": "c60573710d45a99deecac152b8bfb15828552dbfcac9a51b7e38803f1b4d697d",
  "kernel/src/arch/x86_64/serial.rs": "06c8594a1724b757bc66b89b7f1a5339c9d2b3ebc76a0fb9966aed13683f55a1",
  "kernel/src/arch/x86_64/syscall.rs": "64ddaf89484102146ee56dd2777dcdd3bb3e316d08a845337cd0002882ee5499",
  "kernel/src/arch/x86_64/trap.rs": "42a5b084a78f72e315cde7a543f1bcb9136d64b1b84bfa38260c3a2cadfd3b92",
  "kernel/src/arch/x86_64/user_programs.rs": "1e695b2f8de69d8586ef499293f0a0f0a72eefe4601fe6d4ba5d0929b5562889",
  "kernel/src/boot/efi.rs": "ffb66748014393ea9aad02937ae69ad6fb2b0ade790348dfb191a39f01582167",
  "kernel/src/boot/mod.rs": "ecb0e4d50454565d720d5774843d32b3f279a58ae4569270ffc2e96908402b21",
  "kernel/src/boot/stub.rs": "01968a9c4ceb77965d9b2e61bbc2b2499b3f663b6c0d98444c060a6f7f7f3539",
  "kernel/src/bootinfo.rs": "1754e069cba821b11498a386127adea49d1eb0f5d125ef5fbc01c8bc4110b3a6",
  "kernel/src/cell.rs": "cee0e78c795d30aa2d94301091a7f117b45f98b37ff8131d0d5ec10f7dcf144e",
  "kernel/src/console.rs": "1c6bf4d636172bbd26dea9fd104cfae12873661f88e880d8e44ae99565771a19",
  "kernel/src/kmain.rs": "28a1617edc33a64be45ae944b67df144e4890e1ee0ae1cb8c9e80271f23039be",
  "kernel/src/ktest.rs": "a6d71e6216e65576e5baea7bc79d9352ae955278d4bebdd83a40b8eb5ab2bcf4",
  "kernel/src/main.rs": "bbe029fc4ba1c1e99d0cbb0ef01156fbc3822fa2b72fa99948d6d5884a9d776c",
  "kernel/src/mm/addrspace.rs": "5e617ebaf09ff93ae7c6c98bce260d3e132bfbcd32df6d4c6d65601ddebe8fc6",
  "kernel/src/mm/heap.rs": "39c5ab7e769f8ec2e5878496916981c32fe514296f40fe49fec1a18a9ee60016",
  "kernel/src/mm/mod.rs": "c1a1b0044668f1b1342b53953fd6a955a35fe18b8f05e1ad51c28b1305b2067a",
  "kernel/src/mm/pmm.rs": "519a105f8ab348a31a35ac08e60cd53556d6682cad79a233c9f82617a674178e",
  "kernel/src/mm/vmm.rs": "26330794a5e0ec62fe9ceaabe8b9452ca8aeaba3f537a33e8a361fb8200cf0bc",
  "kernel/src/object/channel.rs": "7964342d9cf9a21b8e3276996f48f15a3243100a56fe57df6e71e45ab243ad94",
  "kernel/src/object/handle.rs": "59f0f6cc5e7539cae44e56294b44a5c943db4c10a65d1af255e9fb168c8ac888",
  "kernel/src/object/mod.rs": "ca17006de4af9d7d21209dbeea364525200206da163bae3848fe32bb3cec90db",
  "kernel/src/panic.rs": "adc0270761320b72644f4cd1fb23ab38676782cc8effadb3db151bf5522a0dcb",
  "kernel/src/sched/mod.rs": "207c6cb7d9e7cf220d5eeb34eaa6920098364aaaf49d6700ff816c5acecd7e98",
  "kernel/src/sync.rs": "8fcf41c183370513c0bc765d386fb9a3bb331483183e0556d0547922683f1c87",
  "kernel/src/syscall/mod.rs": "7e17416b72e255a55ad73423a69948d870d5a125d460a1ec8987d5035b1652ba",
  "kernel/src/user.rs": "b9bba6fbf08b8e07a615cc541450f601870b368a00c7b74ea5a72d58f635a135",
  "evidence/20261018T070919Z-0e8a0e93-001/artifact/NAWAH-KTEST.EFI": "f66086073d32ef0f929f60afb1ae39cca3466c6430ed7b8dfec6ce09efa0bffb"
 },
 "claim_tag": "source_backed_fact",
 "reason": "exit code and serial markers match oracle"
}
