{
 "schema_version": "1.0.0",
 "run_id": "20261018T205729Z-cd3edf4c-001",
 "test_id": "TST-M0-001",
 "verdict": "PASS",
 "oracle": "unittest exit 0 and 'OK' in output; 10 cases incl. 6 required rejections",
 "expected": "exit 0 + 'OK'",
 "observed": "exit=0; tail=OK",
 "inputs_digest": "ece77a66b02a325fbe07e23bd10f8eeda855955d7b137869edaa74cb719b7f48",
 "inputs": {
  "tools/project.py": "f3f21f889a784d9baeb8a9bca4cc1903ac289c4f089f96758846b403d84d1646",
  "tools/schemas_gen.py": "14858e34c300bbf8ccb0f3a410e8d0e15fe45f88fc0bf4ff92fff2134ca32b57",
  "tests/test_validate_records.py": "86e7eee5625f1afd173fed860a76e5e9568b411ddaa760e08f54084a0cd7592a",
  "docs/schemas/automation.schema.json": "c626f12ccca8f0c26961e4d4871ca7058aa198d3def3d81facefd464b33004c6",
  "docs/schemas/decisions-pending.schema.json": "1e04aa39b24174e04144639f2cc62ad11fd2ae70f82c5e3cfa024835de1a99a6",
  "docs/schemas/event.schema.json": "6898af974c2bfde6f224bb1345a3f702ac06267c94437d53606827bfcb7107fd",
  "docs/schemas/evidence-run.schema.json": "ae51a025863950a1ae6628e56710a7cc7cb9b3fa116ad1a1535bc42f36648c12",
  "docs/schemas/evidence-verdict.schema.json": "175cc9760068d3e76c418eaad280f79d021d5e24f87001627579b6774230fe55",
  "docs/schemas/hardware.schema.json": "9814136285c9bef1f5d9711d7031d8874a97020ef96b73d2520a7b663b6e1966",
  "docs/schemas/project-state.schema.json": "868e2ad5e8eed8f13dc7d4d8236afbb79b3fb24bd423ff23260aa6a28e61a84d",
  "docs/schemas/requirements.schema.json": "78de45fa0d55896432c5762920e6359747e70a57d43a4bd5e2957c33dd4b6832",
  "docs/schemas/risks.schema.json": "4da7ebf7971bd5fcc75a58778626a66e59190cac71dbc580ec634d681657b1d7",
  "docs/schemas/sources.schema.json": "176a484cfd055ed89aa3085fc175a4f46df28867ccc8034952da7420d43bfaff",
  "docs/schemas/stages.schema.json": "d4c54808283c8f6028e7ff13f22c70c2c54b793b19e7a27b47b04db2d67564ab",
  "docs/schemas/tests.schema.json": "a3844c529fa41c5ee6afa7da0799074f50ffe475e675ae992fe48818a968d5d4",
  "docs/schemas/work-items.schema.json": "18dda423e6d8420637842050278d3b1ed1b034db3d6230307e23f42b5c91a915"
 },
 "claim_tag": "source_backed_fact"
}
