{
 "schema_version": "1.0.0",
 "run_id": "20261018T031602Z-1e20e326-001",
 "test_id": "TST-M2-EXC-DE",
 "verdict": "PASS",
 "oracle": "SDM Table 7-1: #DE vector 0, no error code (fault: RIP at div); lab exit 145",
 "expected": "exit=145; markers=['OSX|1e20e3265dc9|ktest|start|name=exc_de', '|exc|vector=0|name=#DE|error=0x0|', '|stack=kernel']; forbidden=['|ktest|fail|', '|kernel|panic|']",
 "observed": "exit=145; serial_lines=13; missing=[]; forbidden_present=[]",
 "inputs_digest": "70d017d7d947c2c3135cee778bfd5600fc765af5aaa83d2e66e9b5352ee8f03a",
 "inputs": {
  "Cargo.toml": "54810cc7a1974e939ae532f9f0fcec0b12314ff655f65e76736fd5f8f3893a5a",
  "kernel/Cargo.toml": "7efe7575312696786e1c2bcbbdc3b8c52cf49baa22affc7c3952fc6bb63d2a24",
  "kernel/build.rs": "922cec73e6fe957dfcca1ab67d1ea9578cc2a78c139c0f689bb55d4f18df2771",
  ".cargo/config.toml": "7742ee6764f0504f48370f7fccd4cb3d66a10602bbc23dd1bb9fa13de4dac9be",
  "rust-toolchain.toml": "4bf2c38ef0d4ef74d4c4177c31981fab2cf89514c4ade1f305da3f04520a0c50",
  "platform/pc-qemu/target.json": "c9390d5fd232fde4e79c6c6ff6ebce09821b0d4be706fa10529375923aa0676d",
  "kernel/src/arch/mod.rs": "c17c62751757a658f16e8067c55bbde02d338fbc042177090724cad2eca813e3",
  "kernel/src/arch/x86_64/fwcfg.rs": "e021c6aeac77a5fe333e2d757f6b8bcf76a7e62fb86af8bb59a33e726e782d3e",
  "kernel/src/arch/x86_64/gdt.rs": "3453dbc5854a2b6764462a24fa3b7d605c4605ed241013e9da921c4ee988aed6",
  "kernel/src/arch/x86_64/idt.rs": "482fe0c4a276aa05226be6847ce76a85d8c934c04b59038b18c83051cffb2f97",
  "kernel/src/arch/x86_64/ktest.rs": "5437101b5bd4e024993148d491240aff0d678679d3e5560db9827c5b49d5cfde",
  "kernel/src/arch/x86_64/mod.rs": "3b73a5b5b0c55f6e8a2d6f888ca66e28bf002766ed0421798b0a4a59e31b3360",
  "kernel/src/arch/x86_64/port.rs": "996135a95894a3444b207b6f100563d8031e5100586daffa9bd5c2915bf4a7e9",
  "kernel/src/arch/x86_64/qemu.rs": "c60573710d45a99deecac152b8bfb15828552dbfcac9a51b7e38803f1b4d697d",
  "kernel/src/arch/x86_64/serial.rs": "06c8594a1724b757bc66b89b7f1a5339c9d2b3ebc76a0fb9966aed13683f55a1",
  "kernel/src/arch/x86_64/trap.rs": "7ebac39f15d36e39cf406c9beb95b69eac920c81eaef819f356ef4d6d2b74e48",
  "kernel/src/boot/efi.rs": "1a1bf51cdd906a4dc1e3fe08e5f788ea77206ac9ae85f5d89b395fd4156bdf7b",
  "kernel/src/boot/mod.rs": "ecb0e4d50454565d720d5774843d32b3f279a58ae4569270ffc2e96908402b21",
  "kernel/src/boot/stub.rs": "043060ba831a43aff55473940ee51194b26f6c7e976d2121760346f2d560875f",
  "kernel/src/bootinfo.rs": "574c66530bd5a8094168796d663372e99b6d495030797d5d45ef36064233e4c1",
  "kernel/src/cell.rs": "cee0e78c795d30aa2d94301091a7f117b45f98b37ff8131d0d5ec10f7dcf144e",
  "kernel/src/console.rs": "ac1b01d51e2283c3e0d39f743309b92adfd05981f2404b73cddecf2106ca05cc",
  "kernel/src/kmain.rs": "3e5958491182d3693ca66673c98b386426f2cbbb2697de3d2ad60291181ea0d6",
  "kernel/src/ktest.rs": "0d45ce968357aba646c6eda654fb7a276c4ab7b4aa360e1399aae587643fb8ab",
  "kernel/src/main.rs": "6201f1950d0bbaa6ca52cb2c66855bb5ec9b10d0204d0abdada1664fcfbe41b6",
  "kernel/src/mm/mod.rs": "b96382bf7a3be33b718c2d9b1a06f45d9fc8a85d3930fc6fe5c6d957f489cebd",
  "kernel/src/mm/pmm.rs": "bfe759ca58c908c63f1ddeac6215424527242c323a21bd90a64fde676e47f398",
  "evidence/20261018T031602Z-1e20e326-001/artifact/NAWAH-KTEST.EFI": "e33364960b23d7f0dacbebbd75f370455a97af2a0cbbdffe53f605995f8a9de0"
 },
 "claim_tag": "source_backed_fact",
 "reason": "exit code and serial markers match oracle"
}
