{
 "schema_version": "1.0.0",
 "run_id": "20261026T200610Z-5128c3cb-001",
 "test_id": "TST-M3-A64-BOOT",
 "verdict": "PASS",
 "oracle": "AArch64 lab: boot|start arch=aarch64, GetMemoryMap + ExitBootServices succeed (boot|ebs|ok=1), the kernel's post_ebs and pmm self-check lines are printed from kernel code, then semihosting exit 0x10 (QEMU exit status 16); no boot|error, no panic",
 "expected": "exit=16; markers=['OSX|5128c3cb4b28|boot|start|arch=aarch64|boot=uefi|stage=pre_ebs', 'OSX|5128c3cb4b28|boot|ebs|ok=1|attempts=', 'OSX|5128c3cb4b28|kernel|cpu_tables|vbar=firmware|mmu=firmware|stack=kernel', 'OSX|5128c3cb4b28|kernel|post_ebs|map_key=0x', '|kernel|pmm|managed_frames=', '|selfcheck=1', 'OSX|5128c3cb4b28|kernel|a64|el=', '|paging=firmware|exit=0x10']; forbidden=['|boot|error|', '|kernel|panic|']; phases=1",
 "observed": "exit=16; serial_lines=12; missing=[]; forbidden_present=[]",
 "inputs_digest": "9e5930849d217865ae75ad8f488c4c66e1520fc127b92e1c49d0975c17d99bce",
 "inputs": {
  "Cargo.toml": "4156942e292cc1e130a56cb754c7c50e0ddc4434102c2662eb02fe08c211248c",
  "kernel/Cargo.toml": "7efe7575312696786e1c2bcbbdc3b8c52cf49baa22affc7c3952fc6bb63d2a24",
  "kernel/build.rs": "e64efb8f0d6d5cc67609ffd3fdd263e7cbabb7a947c463b51018bb2091b710fc",
  ".cargo/config.toml": "04f33880a4558b10c57b4dad27ba5e368a097c7c931fe694f1f8c9e130406a77",
  "rust-toolchain.toml": "4bf2c38ef0d4ef74d4c4177c31981fab2cf89514c4ade1f305da3f04520a0c50",
  "platform/virt-qemu-aarch64/target.json": "345a24d9984a2edac6d69f3c30af3919399cca419b92056df7ddf6833ec8729f",
  "kernel/src/apps.rs": "17156e4cd91eb7f77b08448bb58556037eefc937b4cc31786deef9000b18d8ad",
  "kernel/src/arch/aarch64/mod.rs": "38420e695f0ae9520a1aefd4aa74dde4ad69fdaf9bbff6002ed0cbffd49660bc",
  "kernel/src/arch/aarch64/qemu.rs": "fd537cd321ed2e7cf49bd8782bdc2341800e8b431fd16b71aff16bc91fa0498d",
  "kernel/src/arch/aarch64/serial.rs": "861b9efee3c6b13b0276ce4315540a0d5a25fbed829b0dc7bf879cc3d97c6ffa",
  "kernel/src/arch/mod.rs": "6b9e277bf1579df955018a14f0aa1421ba62e712e94cbe47805fca427cfd8391",
  "kernel/src/arch/x86_64/acpi.rs": "9d84b03ca009b7b5d8a1b8ba255d896dfc41ec078610b2eec62d49205e2b8867",
  "kernel/src/arch/x86_64/apic.rs": "dcb8a4e76815aa3207c445f4f57d7e8c528df17210a5a4e30b0ad028cd7f2fa1",
  "kernel/src/arch/x86_64/context.rs": "2c198e0d61ce88243410a20b02dac5057cbc138b111ec5868612dc19e1716305",
  "kernel/src/arch/x86_64/fwcfg.rs": "e021c6aeac77a5fe333e2d757f6b8bcf76a7e62fb86af8bb59a33e726e782d3e",
  "kernel/src/arch/x86_64/gdt.rs": "63f2b5b6ebca5297401d1cb874791a7ba7e496d868f75f756dd6b1c90d4db482",
  "kernel/src/arch/x86_64/i8042.rs": "3176bc29c40693f31cd0b48d43a979bab86e5f6d72a03bfb96d515b74241cefd",
  "kernel/src/arch/x86_64/idt.rs": "3f2d4c7025328d44462bae18e8acf623b826698a4b2054b6e052d30799998192",
  "kernel/src/arch/x86_64/ioapic.rs": "3f90e8a4fb369d2e232247adbcc0b71e99db29c2b6dae184e4b88d1c423a3cec",
  "kernel/src/arch/x86_64/irq.rs": "6e654cda9100dc4fe9a19d86829b242627156c41081c3b9b3c561ec09e3effd2",
  "kernel/src/arch/x86_64/ktest.rs": "f0aa4c5912262834cc9162a3b6b0113cac093d3f09eeb129eb1c821039eee207",
  "kernel/src/arch/x86_64/mmio.rs": "5484ac7afb63e810fc2fd88859d804df474ac2f3390e4b22ab41cf3d08c63b94",
  "kernel/src/arch/x86_64/mod.rs": "f205a0ed2d2f3c51df5eeb0e4bf04a75a04113d9a92550922afe61260d2dba54",
  "kernel/src/arch/x86_64/paging.rs": "864b9754739361c2a85b5d79328099e68601d6dc5b6669f4773ccf785192edec",
  "kernel/src/arch/x86_64/pci.rs": "3938f7010b42bd991b5629de84ab972d73f25025d7e402348b0acd3c3d6877da",
  "kernel/src/arch/x86_64/pic.rs": "0563f6cc635ec439b5300986cafddc4156a67a3a3d26044ee0b11a30f3af94b2",
  "kernel/src/arch/x86_64/pit.rs": "c6129002caf1ba3f53a1f705de7b55c6c166a227eb6e8a1612dceedc784b8b82",
  "kernel/src/arch/x86_64/port.rs": "996135a95894a3444b207b6f100563d8031e5100586daffa9bd5c2915bf4a7e9",
  "kernel/src/arch/x86_64/qemu.rs": "c60573710d45a99deecac152b8bfb15828552dbfcac9a51b7e38803f1b4d697d",
  "kernel/src/arch/x86_64/serial.rs": "238e18ed5bcee1d9224d2a1510c49339f8948a02f441c6fac060585315b80c8f",
  "kernel/src/arch/x86_64/serial2.rs": "17e28fd2a0e31e05add40624e65a1728d8be0d0cdc79c0ba633d9a7fa1055630",
  "kernel/src/arch/x86_64/smp.rs": "695d1800902a9de4ffa404d345f71df3cf84e849a179f6dcdddc8c5a051cfe1c",
  "kernel/src/arch/x86_64/syscall.rs": "b25faa136323deca33e8e8cf77e6b64dfea6e0a44212669dedc85c9cec26cd2c",
  "kernel/src/arch/x86_64/tlb.rs": "fbab3b93a0d20e43afa532d672220fd693c43c3cb7a1f0418ea8bcd038be0466",
  "kernel/src/arch/x86_64/trap.rs": "c2fcea6360adbea7fdd269c9ac814cbbd9a09cd09b1f4c6be4b0dd3ddcdbbb92",
  "kernel/src/arch/x86_64/user_programs.rs": "ca153e20ba2039e08473676c58b64f74ca8627213171cdf61be96d6df85bb0bb",
  "kernel/src/block/mod.rs": "45e25137065277c1a490564ef30343ddc398fe6819016a34a1b386a363680935",
  "kernel/src/boot/efi.rs": "8c86feb75e3bf414d417abdd66bd166b5ed251270526df53c83fb5ca8b004106",
  "kernel/src/boot/mod.rs": "ecb0e4d50454565d720d5774843d32b3f279a58ae4569270ffc2e96908402b21",
  "kernel/src/boot/stub.rs": "583340e7a7e20e1f7991eabf8ae8b9813b3df806639e88949183990f54f5bdcf",
  "kernel/src/bootinfo.rs": "1754e069cba821b11498a386127adea49d1eb0f5d125ef5fbc01c8bc4110b3a6",
  "kernel/src/cell.rs": "cee0e78c795d30aa2d94301091a7f117b45f98b37ff8131d0d5ec10f7dcf144e",
  "kernel/src/console.rs": "1c6bf4d636172bbd26dea9fd104cfae12873661f88e880d8e44ae99565771a19",
  "kernel/src/diag.rs": "281fac6f3cb385fd724f7d5757ab2f7d7c1f3a6cdf939e21d095153b0e813507",
  "kernel/src/display.rs": "aad111f04d2c306d70764b612acb9a3ef4b2645aff90f4d138135a217b383aa8",
  "kernel/src/drivers/mod.rs": "bf9366bfd6fe53234660a857b444ad2dd2b95f371fb82087d2586f70aaceafb4",
  "kernel/src/drivers/virtio_blk.rs": "16df73696e259cf773d7fd506cb5c8417100c91aae9645ac1e5f5cccf16f6a87",
  "kernel/src/drivers/virtio_net.rs": "c196958f4812c582d33ceb2596297efe098b3cd15eb92eb157463b65061942cc",
  "kernel/src/fs/fat32.rs": "c49060c1fdcdd21d1fe262462fc37522bfffc626c8005811f62b9c89462751ba",
  "kernel/src/fs/mod.rs": "c9022502ce6aadfd8312ef62e1d1cd4ed7aee4d137ec7367fe924136801163ad",
  "kernel/src/fs/vfs.rs": "da30c06fc8c60eb5204b501fb73824d503739adc7fcc458277b0334752b921da",
  "kernel/src/kmain.rs": "998d70f316edf154cb2130686e5baa3d3d43e6098d5150e586061ec76f91c3ff",
  "kernel/src/ktest.rs": "3c3f2d2d4d30131bfd5f0da239608b112e617b4561d4fbfe9bda80a418f47958",
  "kernel/src/loader/elf.rs": "20675658cd900273c81e253b6f888ed029a9dfa74e14d818ad9c039d6f13564f",
  "kernel/src/loader/mod.rs": "16e0b58c5c703b734120f704e05bf29d7c7da3a787a64705666bf766dff5be38",
  "kernel/src/main.rs": "f23cc746905027b7eb41969e4787aaf06b1249998166ce12c2e62167b0817fec",
  "kernel/src/mm/addrspace.rs": "4a74c66373fe866c0d41ebbc561996af56f5960fd53a7518b2b3dcb006fa22bb",
  "kernel/src/mm/dma.rs": "c2b0fb6856528e12c290ed0ab48c4d578eda9257ef19b00954f066745b6d5785",
  "kernel/src/mm/heap.rs": "39c5ab7e769f8ec2e5878496916981c32fe514296f40fe49fec1a18a9ee60016",
  "kernel/src/mm/mod.rs": "8d3d2818e4f995cbb816a0c11aceb984d7ab3c338cd7f53861786f2a5bdbd68d",
  "kernel/src/mm/pmm.rs": "519a105f8ab348a31a35ac08e60cd53556d6682cad79a233c9f82617a674178e",
  "kernel/src/mm/vmm.rs": "46b37efeb15341f1de1dc7e103da990364b70d81ac2e7bfe019e831f6688596c",
  "kernel/src/net.rs": "3ca161a7a60f3ade192082a749bb23ac37afa9321982e2c50a927da41fb2e4ec",
  "kernel/src/object/bytes.rs": "7f5fc14db8775969e422b37f243dc2f1dbd672570d553475d0ca6e6a07f9858a",
  "kernel/src/object/channel.rs": "74dde46fe8f79472cbcfaaf9e0c58439ad0af5226692cc961a83bdcb1cc5b0e7",
  "kernel/src/object/handle.rs": "8e69ecf24ba6e93951ef6f72120d03329f27d173d23c99242d4ce1b159a19001",
  "kernel/src/object/mod.rs": "a29aed64ba4cde5588909513de9861a6459e97e742826fb46618e109aa46d8d7",
  "kernel/src/object/nic.rs": "5e702b8dc7c6cae9f68047d61a792867eb396fec9ba20e58d87260c492ab722e",
  "kernel/src/object/process.rs": "44900309df4c37b9286b8d4ce652e22ab4fd904b9a89bfa979fd7ce8527c9f0e",
  "kernel/src/object/token.rs": "6175857e5b529468c1f2cf29ddb623440fcd7fe35e84727f15864580ae94fdaa",
  "kernel/src/panic.rs": "adc0270761320b72644f4cd1fb23ab38676782cc8effadb3db151bf5522a0dcb",
  "kernel/src/sched/mod.rs": "bbdccb99fcad770af775b8f9c71a16c5d6350c9a1621db894712ddba376437aa",
  "kernel/src/services.rs": "30c396448a8f8a8a489bde2efe9fbdd507cab3bc8507917621955aadbc102e06",
  "kernel/src/sync.rs": "8a86cc6740aa4789771692fdc365975234c46f56289c0ad3f1b1efcec108b203",
  "kernel/src/syscall/mod.rs": "70ad57e93982cdc4e116cf8d36b7fa6120093d59d9f69d761d07084842ae669e",
  "kernel/src/user.rs": "930f8e01796db24ced24ec7e63d2d2056294244e9ee78e7bbb5308babc3684cc",
  "evidence/20261026T200610Z-5128c3cb-001/artifact/NAWAH-A64.EFI": "37e052caf95effb6258458c8890d5fcd19fd5f8411a2ff71cab4e9d1a9efce68"
 },
 "claim_tag": "source_backed_fact",
 "reason": "exit code and serial markers match oracle"
}
