{
 "schema_version": "1.0.0",
 "run_id": "20261018T073343Z-0366aee5-002",
 "test_id": "TST-M1-NOBS",
 "verdict": "PASS",
 "oracle": "static: kmain.rs is safe-only (no unsafe allowed by main.rs), names no firmware table/efi symbol; boot::efi is private; BootInfo carries no function pointers; kernel_main takes &BootInfo only",
 "expected": "exit 0 + OK",
 "observed": "exit=0; tail=OK",
 "inputs_digest": "0ff52d23cd31475e4c68555f5cf543b3ce1f99c0ca347e2ecb6bb00b2fd26b97",
 "inputs": {
  "tests/test_m1_nobs.py": "ceceb80b4ec0ca8285308f797a303c41a0ef31c877acbb5641639ae3637aac0b",
  "kernel/src/main.rs": "2f1468de2db84330b9f8068e3a5c21933605e14e0df8a7975d74dd2bf97bfaac",
  "kernel/src/kmain.rs": "7dbe6d36c1660a08f740bdb54287df0e27fce0fb17a98765ea419e32ed71f614",
  "kernel/src/bootinfo.rs": "1754e069cba821b11498a386127adea49d1eb0f5d125ef5fbc01c8bc4110b3a6",
  "kernel/src/boot/mod.rs": "ecb0e4d50454565d720d5774843d32b3f279a58ae4569270ffc2e96908402b21",
  "kernel/src/boot/stub.rs": "01968a9c4ceb77965d9b2e61bbc2b2499b3f663b6c0d98444c060a6f7f7f3539"
 },
 "claim_tag": "source_backed_fact"
}
