{
 "schema_version": "1.0.0",
 "run_id": "20261018T050303Z-f4c17400-001",
 "test_id": "TST-M1-BUILD",
 "verdict": "PASS",
 "oracle": "all build steps exit 0 and artifact exists",
 "expected": "exit 0 + artifact",
 "observed": "exit=0 artifact=build/pc-qemu/NAWAH.EFI sha256=5317fad1e9f57f0d7527896c8e5a3f026c75f7674521796109439c71df3cde2d",
 "inputs_digest": "e9c235fa6aec82c425ca8e0e6ab798f79f1c6a3bb0180d3eb86f9800cecb4ee9",
 "inputs": {
  "Cargo.toml": "54810cc7a1974e939ae532f9f0fcec0b12314ff655f65e76736fd5f8f3893a5a",
  "kernel/Cargo.toml": "7efe7575312696786e1c2bcbbdc3b8c52cf49baa22affc7c3952fc6bb63d2a24",
  "kernel/build.rs": "922cec73e6fe957dfcca1ab67d1ea9578cc2a78c139c0f689bb55d4f18df2771",
  ".cargo/config.toml": "7742ee6764f0504f48370f7fccd4cb3d66a10602bbc23dd1bb9fa13de4dac9be",
  "rust-toolchain.toml": "4bf2c38ef0d4ef74d4c4177c31981fab2cf89514c4ade1f305da3f04520a0c50",
  "platform/pc-qemu/target.json": "23b744a9e7bbe5432a9225472298e0000c8570a5fbad3a6bedbf214e2932e506",
  "kernel/src/arch/mod.rs": "22d1f3fcc57b37c41acc63282eed9fe07fbe0ce306d4401aa27c64663ad626e5",
  "kernel/src/arch/x86_64/acpi.rs": "e30e8943340279a81901d0263c6e9d249185104a50df6ae48db9aceebb0159bf",
  "kernel/src/arch/x86_64/apic.rs": "5f3cdc1badd277f4c0fa266644bfd9c532a0d1a37e02e982282be8a664a6949d",
  "kernel/src/arch/x86_64/fwcfg.rs": "e021c6aeac77a5fe333e2d757f6b8bcf76a7e62fb86af8bb59a33e726e782d3e",
  "kernel/src/arch/x86_64/gdt.rs": "d7d83e814203f5214f5832f9d6bb501e37cd305236171db2e39615e5d86c9655",
  "kernel/src/arch/x86_64/idt.rs": "e06da635ca087c86320f07986efcc7a6811f272d6a893c4f1c02b43b2b24ce67",
  "kernel/src/arch/x86_64/ioapic.rs": "3f90e8a4fb369d2e232247adbcc0b71e99db29c2b6dae184e4b88d1c423a3cec",
  "kernel/src/arch/x86_64/irq.rs": "5db9ab4587f3f4a3f7a3cac5eaec0ce26a19a54ac88080bc478c4c3cfd0bcaf5",
  "kernel/src/arch/x86_64/ktest.rs": "34e044b3af5ebd614d920b65924bf4d8fa6068f3902332db693b8f78357f5d11",
  "kernel/src/arch/x86_64/mod.rs": "27a5d389d1dc2f5d86e8c1e8b0b9025b650b6d7f95a1b5858aebeedc395eb356",
  "kernel/src/arch/x86_64/paging.rs": "7b3d72840a276c5d1ecb5988e04f54460bb6217795c5f52df033596cadc708a6",
  "kernel/src/arch/x86_64/pic.rs": "0563f6cc635ec439b5300986cafddc4156a67a3a3d26044ee0b11a30f3af94b2",
  "kernel/src/arch/x86_64/pit.rs": "c55d4335a3454f6ba35b8604c1d0a2c243102b8cd8c5275d7342a0aca7e7b14e",
  "kernel/src/arch/x86_64/port.rs": "996135a95894a3444b207b6f100563d8031e5100586daffa9bd5c2915bf4a7e9",
  "kernel/src/arch/x86_64/qemu.rs": "c60573710d45a99deecac152b8bfb15828552dbfcac9a51b7e38803f1b4d697d",
  "kernel/src/arch/x86_64/serial.rs": "06c8594a1724b757bc66b89b7f1a5339c9d2b3ebc76a0fb9966aed13683f55a1",
  "kernel/src/arch/x86_64/trap.rs": "8cf86f247eb54f1baff129520d4ebf0ff6cc1ee7ead5d814c676d8ecb5f0df3b",
  "kernel/src/boot/efi.rs": "ffb66748014393ea9aad02937ae69ad6fb2b0ade790348dfb191a39f01582167",
  "kernel/src/boot/mod.rs": "ecb0e4d50454565d720d5774843d32b3f279a58ae4569270ffc2e96908402b21",
  "kernel/src/boot/stub.rs": "21219d127412e1fdf60363a0392045ca432b4dbc25cde3bac399e89cb513294d",
  "kernel/src/bootinfo.rs": "21cf91afb370817ca076e94d39ca066b095987d60a80b37109c5a11ee10281cf",
  "kernel/src/cell.rs": "cee0e78c795d30aa2d94301091a7f117b45f98b37ff8131d0d5ec10f7dcf144e",
  "kernel/src/console.rs": "1c6bf4d636172bbd26dea9fd104cfae12873661f88e880d8e44ae99565771a19",
  "kernel/src/kmain.rs": "fd05a2cc184d2417047f8739f5a2af5160823c4815c4a1a3db05e768a01d65f6",
  "kernel/src/ktest.rs": "f4f6e73a290eacb4309b7434554e70bf8a6b2386c07646f9657783a2dc5bc002",
  "kernel/src/main.rs": "6e3c5cc03b7ce8a5c721b0d5889cbd3347ab35230bb9bb619d0f9314f241c067",
  "kernel/src/mm/mod.rs": "1d449de233ff1970e5183145bb0002bbd412c8e980606f800207421abfb98812",
  "kernel/src/mm/pmm.rs": "3ae006b7c8b24a9107b5713f485d698775e92645045250e99cfc5f306e5de0c6",
  "kernel/src/mm/vmm.rs": "f746b09cda7cccf9022037d0d443746cd24ede9bea4566caf88b7310271f184d",
  "kernel/src/panic.rs": "03ac22d77ceca8fdce865110668fb804124a7de035f8eb8d692688bc5264a89b",
  "kernel/src/sync.rs": "8fcf41c183370513c0bc765d386fb9a3bb331483183e0556d0547922683f1c87",
  "evidence/20261018T050303Z-f4c17400-001/artifact/NAWAH.EFI": "5317fad1e9f57f0d7527896c8e5a3f026c75f7674521796109439c71df3cde2d",
  "evidence/20261018T050303Z-f4c17400-001/artifact/NAWAH-NEG.EFI": "28ddab31730fa6ff862c0b4a936cce6b0818c2ca88245c30df6df4fb1f81db4a",
  "evidence/20261018T050303Z-f4c17400-001/artifact/NAWAH-KTEST.EFI": "a0aa2421021ce50b3b565ec4791e5c081814a4ef7f6516624951e73304c3796b"
 },
 "claim_tag": "source_backed_fact"
}
